{
  "name": "latlng-to-cell",
  "description": "200 coordinates → res-9 cell, res 8–5 parents and boundary vertex count: 180 seeded-random points in the Lithuania bounding box (lat 53.90–56.45, lon 20.90–26.85) plus 20 hand-picked (Kaunas landmarks, Vilnius, Klaipėda, Nida, a point 1 m inside a cell edge, the antimeridian on both sides, both poles, the origin, a res-9 pentagon centre and six world cities). Pentagons at odd (class III) resolutions have 10 boundary vertices.",
  "generator": "scripts/generate.ts#latLngToCellCases",
  "version": 1,
  "seed": 20260907,
  "cases": [
    {
      "id": "lt-random-000",
      "input": {
        "lat": 54.900111,
        "lon": 25.464333
      },
      "expected": {
        "r9": "891f40a4247ffff",
        "parents": {
          "r8": "881f40a425fffff",
          "r7": "871f40a42ffffff",
          "r6": "861f40a47ffffff",
          "r5": "851f40a7fffffff"
        },
        "boundaryVertexCount": 6
      }
    },
    {
      "id": "lt-random-001",
      "input": {
        "lat": 55.503382,
        "lon": 21.55665
      },
      "expected": {
        "r9": "891f715622bffff",
        "parents": {
          "r8": "881f715623fffff",
          "r7": "871f71562ffffff",
          "r6": "861f71567ffffff",
          "r5": "851f7157fffffff"
        },
        "boundaryVertexCount": 6
      }
    },
    {
      "id": "lt-random-002",
      "input": {
        "lat": 54.376604,
        "lon": 23.926414
      },
      "expected": {
        "r9": "891f404b36bffff",
        "parents": {
          "r8": "881f404b37fffff",
          "r7": "871f404b3ffffff",
          "r6": "861f404b7ffffff",
          "r5": "851f404bfffffff"
        },
        "boundaryVertexCount": 6
      }
    },
    {
      "id": "lt-random-003",
      "input": {
        "lat": 54.986167,
        "lon": 25.106953
      },
      "expected": {
        "r9": "891f40b1a07ffff",
        "parents": {
          "r8": "881f40b1a1fffff",
          "r7": "871f40b1affffff",
          "r6": "861f40b1fffffff",
          "r5": "851f40b3fffffff"
        },
        "boundaryVertexCount": 6
      }
    },
    {
      "id": "lt-random-004",
      "input": {
        "lat": 55.488765,
        "lon": 23.924749
      },
      "expected": {
        "r9": "891f440e0dbffff",
        "parents": {
          "r8": "881f440e0dfffff",
          "r7": "871f440e0ffffff",
          "r6": "861f440e7ffffff",
          "r5": "851f440ffffffff"
        },
        "boundaryVertexCount": 6
      }
    },
    {
      "id": "lt-random-005",
      "input": {
        "lat": 54.904713,
        "lon": 21.291563
      },
      "expected": {
        "r9": "891f73ab66bffff",
        "parents": {
          "r8": "881f73ab67fffff",
          "r7": "871f73ab6ffffff",
          "r6": "861f73ab7ffffff",
          "r5": "851f73abfffffff"
        },
        "boundaryVertexCount": 6
      }
    },
    {
      "id": "lt-random-006",
      "input": {
        "lat": 54.093991,
        "lon": 24.610035
      },
      "expected": {
        "r9": "891f42a4b3bffff",
        "parents": {
          "r8": "881f42a4b3fffff",
          "r7": "871f42a4bffffff",
          "r6": "861f42a4fffffff",
          "r5": "851f42a7fffffff"
        },
        "boundaryVertexCount": 6
      }
    },
    {
      "id": "lt-random-007",
      "input": {
        "lat": 55.40824,
        "lon": 23.91672
      },
      "expected": {
        "r9": "891f440d18bffff",
        "parents": {
          "r8": "881f440d19fffff",
          "r7": "871f440d1ffffff",
          "r6": "861f440d7ffffff",
          "r5": "851f440ffffffff"
        },
        "boundaryVertexCount": 6
      }
    },
    {
      "id": "lt-random-008",
      "input": {
        "lat": 56.10543,
        "lon": 24.666194
      },
      "expected": {
        "r9": "891f6344d1bffff",
        "parents": {
          "r8": "881f6344d1fffff",
          "r7": "871f6344dffffff",
          "r6": "861f6344fffffff",
          "r5": "851f6347fffffff"
        },
        "boundaryVertexCount": 6
      }
    },
    {
      "id": "lt-random-009",
      "input": {
        "lat": 55.741042,
        "lon": 21.742947
      },
      "expected": {
        "r9": "891f7113413ffff",
        "parents": {
          "r8": "881f711341fffff",
          "r7": "871f71134ffffff",
          "r6": "861f71137ffffff",
          "r5": "851f7113fffffff"
        },
        "boundaryVertexCount": 6
      }
    },
    {
      "id": "lt-random-010",
      "input": {
        "lat": 54.692472,
        "lon": 24.814444
      },
      "expected": {
        "r9": "891f400090fffff",
        "parents": {
          "r8": "881f400091fffff",
          "r7": "871f40009ffffff",
          "r6": "861f4000fffffff",
          "r5": "851f4003fffffff"
        },
        "boundaryVertexCount": 6
      }
    },
    {
      "id": "lt-random-011",
      "input": {
        "lat": 55.857649,
        "lon": 23.732263
      },
      "expected": {
        "r9": "891f44818d3ffff",
        "parents": {
          "r8": "881f44818dfffff",
          "r7": "871f44818ffffff",
          "r6": "861f4481fffffff",
          "r5": "851f4483fffffff"
        },
        "boundaryVertexCount": 6
      }
    },
    {
      "id": "lt-random-012",
      "input": {
        "lat": 54.24332,
        "lon": 21.216028
      },
      "expected": {
        "r9": "891f55d2dcfffff",
        "parents": {
          "r8": "881f55d2ddfffff",
          "r7": "871f55d2dffffff",
          "r6": "861f55d2fffffff",
          "r5": "851f55d3fffffff"
        },
        "boundaryVertexCount": 6
      }
    },
    {
      "id": "lt-random-013",
      "input": {
        "lat": 55.035462,
        "lon": 26.423925
      },
      "expected": {
        "r9": "891f418238fffff",
        "parents": {
          "r8": "881f418239fffff",
          "r7": "871f41823ffffff",
          "r6": "861f41827ffffff",
          "r5": "851f4183fffffff"
        },
        "boundaryVertexCount": 6
      }
    },
    {
      "id": "lt-random-014",
      "input": {
        "lat": 53.95877,
        "lon": 26.16269
      },
      "expected": {
        "r9": "891f43ac087ffff",
        "parents": {
          "r8": "881f43ac09fffff",
          "r7": "871f43ac0ffffff",
          "r6": "861f43ac7ffffff",
          "r5": "851f43affffffff"
        },
        "boundaryVertexCount": 6
      }
    },
    {
      "id": "lt-random-015",
      "input": {
        "lat": 53.906303,
        "lon": 22.704281
      },
      "expected": {
        "r9": "891f5535d03ffff",
        "parents": {
          "r8": "881f5535d1fffff",
          "r7": "871f5535dffffff",
          "r6": "861f5535fffffff",
          "r5": "851f5537fffffff"
        },
        "boundaryVertexCount": 6
      }
    },
    {
      "id": "lt-random-016",
      "input": {
        "lat": 53.973979,
        "lon": 25.866233
      },
      "expected": {
        "r9": "891f43a8697ffff",
        "parents": {
          "r8": "881f43a869fffff",
          "r7": "871f43a86ffffff",
          "r6": "861f43a87ffffff",
          "r5": "851f43abfffffff"
        },
        "boundaryVertexCount": 6
      }
    },
    {
      "id": "lt-random-017",
      "input": {
        "lat": 55.122889,
        "lon": 24.222334
      },
      "expected": {
        "r9": "891f4465b4bffff",
        "parents": {
          "r8": "881f4465b5fffff",
          "r7": "871f4465bffffff",
          "r6": "861f4465fffffff",
          "r5": "851f4467fffffff"
        },
        "boundaryVertexCount": 6
      }
    },
    {
      "id": "lt-random-018",
      "input": {
        "lat": 55.060646,
        "lon": 23.063812
      },
      "expected": {
        "r9": "891f4685917ffff",
        "parents": {
          "r8": "881f468591fffff",
          "r7": "871f46859ffffff",
          "r6": "861f4685fffffff",
          "r5": "851f4687fffffff"
        },
        "boundaryVertexCount": 6
      }
    },
    {
      "id": "lt-random-019",
      "input": {
        "lat": 54.471389,
        "lon": 20.953048
      },
      "expected": {
        "r9": "891f737a883ffff",
        "parents": {
          "r8": "881f737a89fffff",
          "r7": "871f737a8ffffff",
          "r6": "861f737afffffff",
          "r5": "851f737bfffffff"
        },
        "boundaryVertexCount": 6
      }
    },
    {
      "id": "lt-random-020",
      "input": {
        "lat": 54.689598,
        "lon": 23.76101
      },
      "expected": {
        "r9": "891f462650bffff",
        "parents": {
          "r8": "881f462651fffff",
          "r7": "871f46265ffffff",
          "r6": "861f46267ffffff",
          "r5": "851f4627fffffff"
        },
        "boundaryVertexCount": 6
      }
    },
    {
      "id": "lt-random-021",
      "input": {
        "lat": 56.086621,
        "lon": 24.189369
      },
      "expected": {
        "r9": "891f6341637ffff",
        "parents": {
          "r8": "881f634163fffff",
          "r7": "871f63416ffffff",
          "r6": "861f63417ffffff",
          "r5": "851f6343fffffff"
        },
        "boundaryVertexCount": 6
      }
    },
    {
      "id": "lt-random-022",
      "input": {
        "lat": 54.651754,
        "lon": 23.176984
      },
      "expected": {
        "r9": "891f463b147ffff",
        "parents": {
          "r8": "881f463b15fffff",
          "r7": "871f463b1ffffff",
          "r6": "861f463b7ffffff",
          "r5": "851f463bfffffff"
        },
        "boundaryVertexCount": 6
      }
    },
    {
      "id": "lt-random-023",
      "input": {
        "lat": 55.583458,
        "lon": 22.206962
      },
      "expected": {
        "r9": "891f710460bffff",
        "parents": {
          "r8": "881f710461fffff",
          "r7": "871f71046ffffff",
          "r6": "861f71047ffffff",
          "r5": "851f7107fffffff"
        },
        "boundaryVertexCount": 6
      }
    },
    {
      "id": "lt-random-024",
      "input": {
        "lat": 54.640468,
        "lon": 21.019788
      },
      "expected": {
        "r9": "891f7308963ffff",
        "parents": {